Date Accessed,Title,Source,Author,Date Published,Article,Unnamed: 6,Unnamed: 7,Unnamed: 8,Unnamed: 9,Unnamed: 10,Unnamed: 11,Unnamed: 12,Unnamed: 13,Cleaned_Article
2022-05-27,"As US pushes to ban Huawei, UK considers softer approach",Daily Mail,"Jack Stubbs 
Kanishka Singh",2019-02-20,"As US pushes to ban Huawei, UK considers softer approach
By ASSOCIATED PRESS

PUBLISHED: 13:23, 20 February 2019 | UPDATED: 01:53, 21 February 2019

e-mail
15
shares  e-mail
Top
+99Home
LONDON (AP) - Britain can handle the security risks involved with using mobile networks made by China's Huawei, the cybersecurity chief said Wednesday, adding to a growing debate among countries on whether the company should be banned, as the U.S. wants.

Ciaran Martin, the CEO of the U.K. National Cyber Security Centre, said it was important to have ""sustainable diversity"" in the supply of telecommunications equipment. He added that his agency could handle the challenges involved in monitoring suppliers who may not be considered trustworthy - a hint at Huawei.

Huawei, the world's biggest maker of switching gear for phone and internet companies, has faced rising scrutiny over U.S. allegations that it could be forced by the Chinese government to provide access to consumer data on its networks.

As countries roll out new high speed fifth generation, or 5G, mobile networks, they are seeking suppliers and the issue of whether to ban Huawei has become a heated debate.

Some frame it as a cold evaluation of the technical risks. Others see it as part of a broader tussle between the U.S. and China for technological dominance. The U.S. has effectively blocked Huawei for years and is accusing China of stealing technology from foreign companies.

U.S. government officials including Vice President Mike Pence publicly warned European allies against using Huawei during a visit last week.

FILE - In this Jan. 29, 2019, file photo, the logos of Huawei are displayed at its retail shop window reflecting the Ministry of Foreign Affairs office in Beijing. The head of Britain's cybersecurity agency says government oversight of Huawei has proven it can flag up security problems, suggesting he doesn't think the Chinese company needs to be banned from supplying mobile networks. Ciaran Martin, the CEO of the National Cyber Security Centre, also said Wednesday, Feb. 20, 2019 that one of the conditions for maintaining good cybersecurity is having ""sustainable diversity"" in the telecommunications equipment supplier market. (AP Photo/Andy Wong, File)
+1
View gallery
FILE - In this Jan. 29, 2019, file photo, the logos of Huawei are displayed at its retail shop window reflecting the Ministry of Foreign Affairs office in Beijing. The head of Britain's cybersecurity agency says government oversight of Huawei has proven it can flag up security problems, suggesting he doesn't think the Chinese company needs to be banned from supplying mobile networks. Ciaran Martin, the CEO of the National Cyber Security Centre, also said Wednesday, Feb. 20, 2019 that one of the conditions for maintaining good cybersecurity is having ""sustainable diversity"" in the telecommunications equipment supplier market. (AP Photo/Andy Wong, File)

TRENDING

Shameless star Tina Malone bids farewell to her army veteran husband
12k viewing now

The hell of being married to a sex addict
162.1k viewing now

'Brilliant' father-of-two died after doctors botched treatment
8.9k viewing now
Authorities and telecom operators in countries such as Germany, Norway and the Czech Republic have been reassessing Huawei's role in 5G networks while Australia, New Zealand and Japan have already moved to curb the use of its gear to varying degrees.

China has stridently defended Huawei, considered a crown jewel in its push to become a global technology power, and denounced security concerns as part of a U.S.-led plot to restrain the country's development.

""The United States and a few of its allies are using double standards and deliberately misleading the public on the issue,"" Foreign Ministry spokesman Geng Shuang said Monday.

""It's hypocritical, immoral and unfair bullying behaviors,"" said Geng.

Experts say Huawei networks are generally cheaper than those of competitors and are of a high quality, making it a difficult decision for governments and telecom operators to shun the supplier altogether. Banning Huawei could also delay the rollout of 5G networks, which are considered necessary for the next generation of internet-connected things, from self-driving cars to smart factories.

The British government is due to complete a review of its policies on the safety of 5G in March or April.

Martin said no decisions have yet been made and ""everything is on the table.""

Since 2010, the British government has operated a cybersecurity evaluation center for Huawei equipment, which Martin said was part of ""the toughest and most rigorous oversight regime in the world"" for the company.

""And it is proving its worth,"" he said, according to a transcript of a speech he gave at a conference in Brussels.

The cybersecurity center in July identified technical issues in Huawei's engineering processes that could make it less safe. Huawei said last month that it would take three to five years to fix the problems.

Martin said the issues his agency identified relate to cybersecurity standards and are ""not indicators of hostile activity by China."" He told reporters that mistakes in software are the biggest issue for cybersecurity, more so than the risk of a foreign government getting backdoor access.

Huawei competes with a few big rivals, notably Finland's Nokia and Sweden's Ericsson, to supply equipment for 5G networks.

Martin said it's important not to let the telecom equipment supplier market shrink too much.

""Any company in an excessively dominant market position will not be incentivized to take cybersecurity seriously,"" Martin said, adding that such a company could be a ""prime target for attack for the globe's most potent cyber attackers.""

In a sign of Britain's division over 5G, a security think tank warned the same day against using Huawei gear.

""Allowing Huawei's participation is at best naive, at worst irresponsible,"" the Royal United Services Institute said in a report, which cited factors including the difficulty of finding hidden ""back doors"" in software.

Germany is still undecided on what to do. It has made clear it doesn't plan to explicitly bar any single manufacturer, though that leaves open the possibility it could frame system requirements in a way that effectively excludes Huawei.

Officials are wary of the security issues that could arise with Chinese involvement, and the German Interior Ministry said Wednesday that internal discussions were still ongoing on how to proceed.

""A direct exclusion of a particular manufacturer from the 5G expansion is at the time not legally possible and also not planned,"" the Interior Ministry told The Associated Press. ""For the Interior Ministry the focus is on adapting the security requirements of the telecommunications network in such a way that the security of the network remains guaranteed, including from possibly non-trustworthy manufacturers.""

The ministry said for that to be ensured, the requirements must be anchored in Germany's telecommunications law and discussions on how to do that are currently ongoing.

___

AP journalists Frank Jordans and David Rising in Berlin and Christopher Bodeen in Beijing contributed to this report.

Share or comment on this article: As US pushes to ban Huawei, UK considers softer approach",,,,,,,,,u push ban huawei uk considers softer approach associated press published february updated february email share email top home london ap britain handle security risk involved using mobile network made china huawei cybersecurity chief said wednesday adding growing debate among country whether company banned u want ciaran martin ceo uk national cyber security centre said important sustainable diversity supply telecommunication equipment added agency could handle challenge involved monitoring supplier may considered trustworthy hint huawei huawei world biggest maker switching gear phone internet company faced rising scrutiny u allegation could forced chinese government provide access consumer data network country roll new high speed fifth generation g mobile network seeking supplier issue whether ban huawei become heated debate frame cold evaluation technical risk others see part broader tussle u china technological dominance u effectively blocked huawei year accusing china stealing technology foreign company u government official including vice president mike penny publicly warned european ally using huawei visit last week file jan file photo logo huawei displayed retail shop window reflecting ministry foreign affair office beijing head britain cybersecurity agency say government oversight huawei proven flag security problem suggesting doesnt think chinese company need banned supplying mobile network ciaran martin ceo national cyber security centre also said wednesday feb one condition maintaining good cybersecurity sustainable diversity telecommunication equipment supplier market ap photoandy wong file view gallery file jan file photo logo huawei displayed retail shop window reflecting ministry foreign affair office beijing head britain cybersecurity agency say government oversight huawei proven flag security problem suggesting doesnt think chinese company need banned supplying mobile network ciaran martin ceo national cyber security centre also said wednesday feb one condition maintaining good cybersecurity sustainable diversity telecommunication equipment supplier market ap photoandy wong file trending shameless star tina malone bid farewell army veteran husband k viewing hell married sex addict k viewing brilliant fatheroftwo died doctor botched treatment k viewing authority telecom operator country germany norway czech republic reassessing huaweis role g network australia new zealand japan already moved curb use gear varying degree china stridently defended huawei considered crown jewel push become global technology power denounced security concern part usled plot restrain country development united state ally using double standard deliberately misleading public issue foreign ministry spokesman geng shuang said monday hypocritical immoral unfair bullying behavior said geng expert say huawei network generally cheaper competitor high quality making difficult decision government telecom operator shun supplier altogether banning huawei could also delay rollout g network considered necessary next generation internetconnected thing selfdriving car smart factory british government due complete review policy safety g march april martin said decision yet made everything table since british government operated cybersecurity evaluation center huawei equipment martin said part toughest rigorous oversight regime world company proving worth said according transcript speech gave conference brussels cybersecurity center july identified technical issue huaweis engineering process could make le safe huawei said last month would take three five year fix problem martin said issue agency identified relate cybersecurity standard indicator hostile activity china told reporter mistake software biggest issue cybersecurity risk foreign government getting backdoor access huawei competes big rival notably finland nokia sweden ericsson supply equipment g network martin said important let telecom equipment supplier market shrink much company excessively dominant market position incentivized take cybersecurity seriously martin said adding company could prime target attack globe potent cyber attacker sign britain division g security think tank warned day using huawei gear allowing huaweis participation best naive worst irresponsible royal united service institute said report cited factor including difficulty finding hidden back door software germany still undecided made clear doesnt plan explicitly bar single manufacturer though leaf open possibility could frame system requirement way effectively excludes huawei official wary security issue could arise chinese involvement german interior ministry said wednesday internal discussion still ongoing proceed direct exclusion particular manufacturer g expansion time legally possible also planned interior ministry told associated press interior ministry focus adapting security requirement telecommunication network way security network remains guaranteed including possibly nontrustworthy manufacturer ministry said ensured requirement must anchored germany telecommunication law discussion currently ongoing ___ ap journalist frank jordan david rising berlin christopher bodeen beijing contributed report share comment article u push ban huawei uk considers softer approach
2022-06-27,Ban on Huawei in UK´s 5G network moves closer after passing first Commons hurdle,Daily Mail,,2020-11-30,"Ban on Huawei in UK´s 5G network moves closer after passing first Commons hurdle
By PRESS ASSOCIATION

PUBLISHED: 22:34, 30 November 2020 | UPDATED: 22:34, 30 November 2020

e-mail
  e-mail
Top
+99Home
A bid to block the installation of new Huawei technology in the UK’s 5G network has passed its first Commons hurdle.

The Telecommunications (Security) Bill passed its second reading without a division and will now progress for further scrutiny.

Culture Secretary Oliver Dowden told the Commons the Bill is designed to tackle “not only the Huaweis of today but the Huaweis of tomorrow wherever they come from”.

He added: “It does need to be flexible enough to cover future threats and not tie our hands by limiting our response to one company and one company alone.”

The Bill would force providers to stop installing Huawei equipment in the UK’s 5G networks from next September and it also sets out a roadmap to remove high-risk vendors altogether.

Conservative former leader Sir Iain Duncan Smith said the September 2021 date was “better than I would have expected”, before raising concerns about the UK’s Government past approach to China and suggesting a more formal structure to advise the Secretary of State on future decisions is required.

He added: “Otherwise it’ll be too easy for a Secretary of State under pressure from the Business Secretary, under pressure from a Chancellor – such as one which we once had (George Osborne) who was very keen on a golden era – leaning and saying ‘do you know what, do you really need to go down this road?’, that will happen.

“I sat as a Secretary of State, I can tell you now all that stuff happens and anybody else will tell you too.

“So, I think a more structured approach does not allow the Secretary of State to miss the right people on advice.”

In the summer, the Government announced that the Chinese firm was to be banned from the most sensitive core parts of UK networks.

It followed a growing backlash from Conservative backbenchers over a decision in January to allow Huawei technology in the UK’s 5G network, albeit with restrictions.

Tom Tugendhat, Conservative chairman of the Commons Foreign Affairs Select Committee, said the Government has listened to its backbenchers’ concerns.

He added: “The minister has done a very good job in listening. There was a time earlier this year when many of us thought this could become a very difficult issue for the Government.

“I have to say the minister and his entire department have done a fantastic job in listening, not just to this side of the House but the other and making sure that the points that we raised have been addressed.”

Labour’s shadow culture secretary Jo Stevens said action to remove high-risk vendors from the UK’s telecoms networks must go hand in hand with measures to diversify the supply chain.

She said: “Let’s be frank, until this year the Government had failed to face reality.

“We will not oppose the second reading of this Bill, but we have many concerns which will need to be considered and addressed at committee stage because the Bill this House eventually passes must take steps to ensure that our telecoms supply chain is resilient in the future or we’ll be forced to return here again in a short time to deal with the next Huawei.

“We must be mindful as with all legislation that we seek to anticipate the problems of the future rather than just deal with the issue we face today. We, of course, fully support steps to remove high-risk vendors from the network, but they absolutely must go hand in hand with credible measures to diversify the supply chain.”

The Bill will force the removal of all Huawei equipment from 5G networks by 2027 and create national security powers capable of imposing controls on when – if at all – a telecoms firm could use material supplied by companies such as Huawei.

The Government has published a 5G Supply Chain Diversification Strategy to ensure the UK is “never again dependent on a handful of telecoms vendors”.

Under the legislation, security protocols around UK networks will also be strengthened with fines – of 10% of turnover or £100,000 a day – for those who do not meet the new standards.

Communications regulator Ofcom is to be tasked with the monitoring and assessing of security protocols among telecoms providers.",,,,,,,,,ban huawei uk g network move closer passing first common hurdle press association published november updated november email email top home bid block installation new huawei technology uk g network passed first common hurdle telecommunication security bill passed second reading without division progress scrutiny culture secretary oliver dowden told common bill designed tackle huaweis today huaweis tomorrow wherever come added need flexible enough cover future threat tie hand limiting response one company one company alone bill would force provider stop installing huawei equipment uk g network next september also set roadmap remove highrisk vendor altogether conservative former leader sir iain duncan smith said september date better would expected raising concern uk government past approach china suggesting formal structure advise secretary state future decision required added otherwise itll easy secretary state pressure business secretary pressure chancellor one george osborne keen golden era leaning saying know really need go road happen sat secretary state tell stuff happens anybody else tell think structured approach allow secretary state miss right people advice summer government announced chinese firm banned sensitive core part uk network followed growing backlash conservative backbencher decision january allow huawei technology uk g network albeit restriction tom tugendhat conservative chairman common foreign affair select committee said government listened backbencher concern added minister done good job listening time earlier year many u thought could become difficult issue government say minister entire department done fantastic job listening side house making sure point raised addressed labour shadow culture secretary jo stevens said action remove highrisk vendor uk telecom network must go hand hand measure diversify supply chain said let frank year government failed face reality oppose second reading bill many concern need considered addressed committee stage bill house eventually pass must take step ensure telecom supply chain resilient future well forced return short time deal next huawei must mindful legislation seek anticipate problem future rather deal issue face today course fully support step remove highrisk vendor network absolutely must go hand hand credible measure diversify supply chain bill force removal huawei equipment g network create national security power capable imposing control telecom firm could use material supplied company huawei government published g supply chain diversification strategy ensure uk never dependent handful telecom vendor legislation security protocol around uk network also strengthened fine turnover day meet new standard communication regulator ofcom tasked monitoring assessing security protocol among telecom provider
