Date Accessed,Title,Source,Author,Date Published,Article,Unnamed: 6,Unnamed: 7,Unnamed: 8,Unnamed: 9,Unnamed: 10,Unnamed: 11,Unnamed: 12,Unnamed: 13,Cleaned_Article
,https://www.foxnews.com/world/uk-spy-chief-says-rise-china-worlds-top-security-issue,Fox News,,,"UK spy chief says rise of China world's top security issue
Jeremy Fleming, director of GCHQ, stated that China is attempting to gain control by fragmenting the use of the internet
Associated Press
Published October 11, 2022 2:45pm EDT
Facebook
Twitter
Flipboard
Comments
Print
Email

Fox News Flash top headlines for October 11
Fox News Flash top headlines are here. Check out what's clicking on Foxnews.com.

The head of Britain’s cyber-intelligence agency on Tuesday accused China of trying to ""rewrite the rules of international security,"" saying Beijing is using its economic and technological clout to clamp down at home and exert control abroad.

Jeremy Fleming, director of GCHQ, said that despite war raging in Europe since Russia's invasion of Ukraine, Beijing’s growing power is ""the national security issue that will define our future.""

In a rare public speech to the Royal United Services Institute think tank, Fleming alleged that Beijing’s Communist authorities want to ""gain strategic advantage by shaping the world’s technology ecosystem.""

""When it comes to technology, the politically motivated actions of the Chinese state is an increasingly urgent problem we must acknowledge and address,"" Fleming said. ""That’s because it’s changing the definition of national security into a much broader concept. Technology has become not just an area for opportunity, for competition and collaboration, it’s a battleground for control, values and influence.""

TAIWAN SAYS WAR WITH CHINA 'ABSOLUTELY' NOT AN OPTION, BUT BOLSTERING DEFENCES

Jeremy Fleming standing in front of a brick building
FILE - Jeremy Fleming, head of the British Government Communications Headquarters (GCHQ), is photographed in London, Thursday, Feb. 14, 2019. In a rare public speech Tuesday, Oct. 11, 2022 to the Royal United Services Institute think tank, Fleming accused China of using its economic and technological clout to clamp down at home and exert control abroad, saying Beijing’s aggressive stance is driven by fear and poses ""a huge threat to us all."" (AP Photo/Frank Augstein, File) (AP Photo/Frank Augstein, File)

He argued that the one-party system in Beijing seeks to control China’s population and sees other countries ""as either potential adversaries or potential client states, to be threatened, bribed or coerced.""

Relations between Britain and China have grown increasingly frosty in recent years, with U.K. officials accusing Beijing of economic subterfuge and human rights abuses.

British spies have given increasingly negative assessments of Beijing’s influence and intentions. Last year the head of the MI6 overseas intelligence agency, Richard Moore, called China one of the biggest threats to Britain and its allies.

WSJ EDITORIAL SLAMS THE UNITED NATIONS HUMAN RIGHTS COUNCIL FOR REFUSING TO DISCUSS CHINA’S UYGHUR GENOCIDE

Crowd standing with Chinese flags
A woman folds a flag after posing for a picture at the Museum of the Communist Party of China in Beijing on September 4, 2022. (Photo by Noel Celis / AFP) (Photo by NOEL CELIS/AFP via Getty Images) ((Photo by Noel Celis / AFP) (Photo by NOEL CELIS/AFP via Getty Images))

In 2020, then-British Prime Minister Boris Johnson followed the United States in banning Chinese tech firm Huawei as a security risk, ordering it to be stripped out of the U.K.’s 5G telecoms network by 2027.

Fleming warned that China is seeking to fragment the infrastructure of the internet to exert greater control. He also said China is seeking to use digital currencies used by central banks to snoop on users’ transactions and as a way of avoiding future international sanctions of the sort imposed on Russia over its invasion of Ukraine.

Fleming argued that China’s BeiDou satellite system — an alternative to the widely used GPS navigation technology — could contain ""a powerful anti-satellite capability, with a doctrine of denying other nations access to space in the event of a conflict.""

REPUBLICANS DEMAND ANSWERS FROM BIDEN OFFICIALS ON REPORT CHINA OPENED POLICE ARM IN NYC

Rocket launching into space
The crewed spaceship Shenzhou-13, atop a Long March-2F carrier rocket, is launched from the Jiuquan Satellite Launch Center in northwest China's Gobi Desert, Oct. 16, 2021. ((Chinatopix Via AP))

Fleming warned that the world is approaching a ""sliding doors"" moment in history — a reference to the 1998 Gwyneth Paltrow film in which a woman’s fate hinges on a seemingly trivial moment.

He called on Western firms and researchers to toughen intellectual property protections and for democratic countries to develop alternatives that can prevent developing nations from ""mortgaging the future by buying into the Chinese vision for technology.""

He said the world’s democracies can't afford to fall behind in cutting-edge fields such as quantum computing, and warned of a potential weakness over semiconductors, the critical chips used in everyday electronics. Taiwan — which China regards as a breakaway province to be reclaimed by force if necessary — is a world leader in their production.

DOUGLAS MURRAY ISSUES STARK WARNING AFTER CHINA'S ELON MUSK THREAT: THEIR VISION IS 'ABSOLUTE HELL' FOR US

Picture of a person taking a picture of a semiconductor
Visitors carefully observe various kinds of chips are exhibited at different booths by semiconductor companies at the 18th China International Semiconductor Expo, Shanghai, China, 14 October 2020.  (Imaginechina via AP Images) (Imaginechina via AP Images)

""Events in the Taiwan Straits — any risk to that vital supply chain — have the potential to directly impact the resilience of the U.K. and global future growth,"" Fleming said.

Fleming also addressed the war in Ukraine, saying Russia is running short of weapons and Ukraine’s ""courageous action on the battlefield and in cyberspace is turning the tide.""

""Russia’s forces are exhausted,"" he said. ""The use of prisoners to reinforce, and now the mobilization of tens of thousands of inexperienced conscripts, speaks of a desperate situation.""

CLICK HERE TO GET THE FOX NEWS APP

GCHQ, formally known as the Government Communications Headquarters, is one of Britain’s three main intelligence agencies, alongside MI5 and MI6. It did not disclose the sources of its intelligence on China and Russia.",,,,,,,,,uk spy chief say rise china world top security issue jeremy fleming director gchq stated china attempting gain control fragmenting use internet associated press published october pm edt facebook twitter flipboard comment print email fox news flash top headline october fox news flash top headline check whats clicking foxnewscom head britain cyberintelligence agency tuesday accused china trying rewrite rule international security saying beijing using economic technological clout clamp home exert control abroad jeremy fleming director gchq said despite war raging europe since russia invasion ukraine beijing growing power national security issue define future rare public speech royal united service institute think tank fleming alleged beijing communist authority want gain strategic advantage shaping world technology ecosystem come technology politically motivated action chinese state increasingly urgent problem must acknowledge address fleming said thats changing definition national security much broader concept technology become area opportunity competition collaboration battleground control value influence taiwan say war china absolutely option bolstering defence jeremy fleming standing front brick building file jeremy fleming head british government communication headquarters gchq photographed london thursday feb rare public speech tuesday oct royal united service institute think tank fleming accused china using economic technological clout clamp home exert control abroad saying beijing aggressive stance driven fear pose huge threat u ap photofrank augstein file ap photofrank augstein file argued oneparty system beijing seek control china population see country either potential adversary potential client state threatened bribed coerced relation britain china grown increasingly frosty recent year uk official accusing beijing economic subterfuge human right abuse british spy given increasingly negative assessment beijing influence intention last year head mi overseas intelligence agency richard moore called china one biggest threat britain ally wsj editorial slam united nation human right council refusing discus china uyghur genocide crowd standing chinese flag woman fold flag posing picture museum communist party china beijing september photo noel celis afp photo noel celisafp via getty image photo noel celis afp photo noel celisafp via getty image thenbritish prime minister boris johnson followed united state banning chinese tech firm huawei security risk ordering stripped uk g telecom network fleming warned china seeking fragment infrastructure internet exert greater control also said china seeking use digital currency used central bank snoop user transaction way avoiding future international sanction sort imposed russia invasion ukraine fleming argued china beidou satellite system alternative widely used gps navigation technology could contain powerful antisatellite capability doctrine denying nation access space event conflict republican demand answer biden official report china opened police arm nyc rocket launching space crewed spaceship shenzhou atop long marchf carrier rocket launched jiuquan satellite launch center northwest china gobi desert oct chinatopix via ap fleming warned world approaching sliding door moment history reference gwyneth paltrow film woman fate hinge seemingly trivial moment called western firm researcher toughen intellectual property protection democratic country develop alternative prevent developing nation mortgaging future buying chinese vision technology said world democracy cant afford fall behind cuttingedge field quantum computing warned potential weakness semiconductor critical chip used everyday electronics taiwan china regard breakaway province reclaimed force necessary world leader production douglas murray issue stark warning china elon musk threat vision absolute hell u picture person taking picture semiconductor visitor carefully observe various kind chip exhibited different booth semiconductor company th china international semiconductor expo shanghai china october imaginechina via ap image imaginechina via ap image event taiwan strait risk vital supply chain potential directly impact resilience uk global future growth fleming said fleming also addressed war ukraine saying russia running short weapon ukraine courageous action battlefield cyberspace turning tide russia force exhausted said use prisoner reinforce mobilization ten thousand inexperienced conscript speaks desperate situation click get fox news app gchq formally known government communication headquarters one britain three main intelligence agency alongside mi mi disclose source intelligence china russia
,https://www.foxnews.com/politics/fcc-barred-national-security-loophole-bill,Fox News,,,"Chinese firms, including Huawei, barred from using national security loophole in new bill
Sen. Rubio says 'Chinese state-directed companies like Huawei and ZTE pose a serious risk to our national security'
Houston Keene By Houston Keene Fox News
Published May 27, 2021 3:32pm EDT
Facebook
Twitter
Flipboard
Comments
Print
Email
close

UK reverses decision to give Huawei role in 5G development
A new bipartisan bill in the Senate will require the Federal Communications Commission (FCC) to hold off on clearing business requests from companies on the commission’s national security threat list, including the Chinese company Huawei.

Sens. Marco Rubio, R-Fla., and Ed Markey, D-Mass., introduced the Secure Equipment Act of 2021, a bill that aims to stop the FCC from reviewing and approving business applications from companies on the commission’s ""Covered List.""

According to a press release issued Monday, the bill would also ""prevent further integration and sales"" of ""Chinese state-backed or directed firms,"" such as Huawei and ZTE, in America ""regardless of whether federal funds are involved.""

Under current law, U.S. telecommunications carriers are only allowed to take down equipment purchased with federal funds, creating an exploitable loophole.

""Chinese state-directed companies like Huawei and ZTE pose a serious risk to our national security,"" Rubio said in the release. ""The Chinese Communist Party subsidizes these companies and exploits loopholes in our laws to allow malicious actors to sell compromised equipment and services in the U.S.

CHINA ‘COVER-UP’ HAMPERING INVESTIGATION INTO COVID ORIGIN: TOP US GENERAL

""The status quo is dangerous, and we need to act now to strengthen our national security and protect our critical infrastructure,"" the Florida Republican added.

Markey said in the statement that the U.S. ""must animate our technology with our values, especially in the 5G networks that are critical to our future economic prosperity.""

""That’s why our bipartisan legislation will make sure all of our devices and equipment are safe for consumers and secure for the United States,"" Markey continued. ""I’m proud to partner with Sen. Rubio on this commonsense proposal and I look forward to fighting together for its swift passage.""

FCC Commissioner Brendan Carr applauded the two senators in the release for their ""leadership and bold action.""

SEN. BEN SASSE PRESSES ODNI NOMINEE OVER HIS WORK FOR HUAWEI

""Their legislation would strengthen our national security by ensuring that we close the loophole that Huawei and others are using right now despite our determination that their gear poses an unacceptable risk to our national security,"" Carr said.

According to the release, the FCC adopted new rules in 2020 requiring U.S. telecommunications companies to take down and replace equipment from Huawei and other companies that are on the commission’s Covered List.

CLICK HERE TO GET THE FOX NEWS APP

Huawei and ZTE were banned from building communications infrastructure in the U.S. with federal subsidies after the FCC declared the two companies ""national security threats"" last summer.",,,,,,,,,chinese firm including huawei barred using national security loophole new bill sen rubio say chinese statedirected company like huawei zte pose serious risk national security houston keene houston keene fox news published may pm edt facebook twitter flipboard comment print email close uk revers decision give huawei role g development new bipartisan bill senate require federal communication commission fcc hold clearing business request company commission national security threat list including chinese company huawei sen marco rubio rfla ed markey dmass introduced secure equipment act bill aim stop fcc reviewing approving business application company commission covered list according press release issued monday bill would also prevent integration sale chinese statebacked directed firm huawei zte america regardless whether federal fund involved current law u telecommunication carrier allowed take equipment purchased federal fund creating exploitable loophole chinese statedirected company like huawei zte pose serious risk national security rubio said release chinese communist party subsidizes company exploit loophole law allow malicious actor sell compromised equipment service u china coverup hampering investigation covid origin top u general status quo dangerous need act strengthen national security protect critical infrastructure florida republican added markey said statement u must animate technology value especially g network critical future economic prosperity thats bipartisan legislation make sure device equipment safe consumer secure united state markey continued im proud partner sen rubio commonsense proposal look forward fighting together swift passage fcc commissioner brendan carr applauded two senator release leadership bold action sen ben sasse press odni nominee work huawei legislation would strengthen national security ensuring close loophole huawei others using right despite determination gear pose unacceptable risk national security carr said according release fcc adopted new rule requiring u telecommunication company take replace equipment huawei company commission covered list click get fox news app huawei zte banned building communication infrastructure u federal subsidy fcc declared two company national security threat last summer
