Date Accessed,Title,Source,Author,Date Published,Article,Unnamed: 6,Unnamed: 7,Unnamed: 8,Unnamed: 9,Unnamed: 10,Unnamed: 11,Unnamed: 12,Unnamed: 13,Cleaned_Article
2022-06-23,Hong Kong: China says it will not recognise UK overseas passports,Guardian ,Patrick Wintour,2020-07-30,"Hong Kong: China says it will not recognise UK overseas passports
This article is more than 3 years old
Ambassador’s warning comes in response to UK’s special visa offer to Hong Kong citizens

Patrick Wintour Diplomatic editor
Thu 30 Jul 2020 15.57 BST
Share
China will not recognise the British national (overseas) passport as a legal travel document, raising the prospect that the 3 million Hong Kong citizens eligible for the passport will be banned from leaving Hong Kong by the Chinese government.

The warning was made at a press conference by the Chinese ambassador to the UK, Liu Xiaoming, in which he also warned that it was hard to imagine a global Britain that bypassed or excluded China. Decoupling from China would mean decoupling from growth and the future, he suggested.

UK-China relations have headed into deep freeze after the UK banned the China state-backed Huawei from UK 5G technology and then protested over the introduction of new security laws in Hong Kong, a former British colony.

protesters against the new national security law gesture with five fingers, signifying the “Five demands - not one less” on the anniversary of Hong Kong’s handover to China
UK reveals details of special Hong Kong visa for overseas nationals
Read more
Liu punctuated his online press conference with videos seeking to debunk reports that Uighur Muslims have been suppressed in Xinjiang province, saying those sent to re-education centres, which he claimed were akin to boarding schools, were only going through the same kind of anti-radicalisation training as terrorists in the west.

He said it was the UK, and not China, that had changed, and should take full responsibility for the current difficulties in the relationship. He blamed cold-war warriors in the Conservative party, and said they were influenced by outside powers. The UK and China should have the wisdom not to allow anti-China forces and cold-war warriors to kidnap the relationship, he said. Great Britain, he argued, “cannot be great if it does not have independent foreign policies”.

The ambassador was reluctant to be drawn on the practical implications of refusing to recognise the BNO passport as a valid travel document, but said the move was a response to the UK’s decision to offer a right for all those eligible for a BNO passport to seek a path to citizenship in the UK.

He said the offer breached the 1984 Memorandum of Agreement that promised the UK would not provide a permanent right of abode to BNO passport-holders. “Since the UK have violated their commitment, we have to let them know that we have to take measures not to recognise the BNO passport as a valid travel document,” he said.

The refusal to recognise the BNO passport in theory raises the prospect of tens of thousands of Hong Kong citizens being trapped in the city or being refused re-entry if they leave the country and try to return, although there was some confusion over the practical impact of the policy, since Hong Kong residents say they can leave and re-enter Hong Kong without showing a BNO passport. An ID card is normally sufficient to pass through immigration.

He also urged British politicians not to follow up the Huawei decision by forcing China out of the French-led nuclear project Hinkley Point C, saying the project would allow the UK to meet its commitment to reach zero-carbon emissions by 2050.

His press conference came alongside an article in the South China Morning Post that he said no British newspaper would publish, threatening to withdraw several billions in investment following the government’s decision to ban Huawei’s products from 5G mobile networks.

Liu wrote: “In 2018, the company announced a further investment plan of £3bn in the next five years, which is a positive vote for growth in Britain. Unfortunately, this will now be subject to uncertainties in light of the British government’s recent decision.”

He also suggested the UK decision meant the UK may miss out on the “development bonus” of China, the world’s fastest-growing economy.

Liu, the ambassador in the UK for a decade, also defended the disqualification of 12 pro-democracy candidates from this autumn’s legislative elections in Hong Kong, saying the new security laws had nothing to do with free speech and targeted a few criminals.

He repeatedly said China had no desire to export its model, promising: “We do not want to threaten, challenge or replace anyone.” He insisted: “China threatens no one. We just let you know the consequences. China wants to be a friend of the UK and a UK partner, but if you do not want to be a partner and our friend, and you want to treat China as a hostile power, you will pay the price.

“We have a thousand reasons to make this relationship successful and not one reason to make it fail.”",,,,,,,,,hong kong china say recognise uk overseas passport article year old ambassador warning come response uk special visa offer hong kong citizen patrick wintour diplomatic editor thu jul bst share china recognise british national overseas passport legal travel document raising prospect million hong kong citizen eligible passport banned leaving hong kong chinese government warning made press conference chinese ambassador uk liu xiaoming also warned hard imagine global britain bypassed excluded china decoupling china would mean decoupling growth future suggested ukchina relation headed deep freeze uk banned china statebacked huawei uk g technology protested introduction new security law hong kong former british colony protester new national security law gesture five finger signifying five demand one le anniversary hong kongs handover china uk reveals detail special hong kong visa overseas national read liu punctuated online press conference video seeking debunk report uighur muslim suppressed xinjiang province saying sent reeducation centre claimed akin boarding school going kind antiradicalisation training terrorist west said uk china changed take full responsibility current difficulty relationship blamed coldwar warrior conservative party said influenced outside power uk china wisdom allow antichina force coldwar warrior kidnap relationship said great britain argued cannot great independent foreign policy ambassador reluctant drawn practical implication refusing recognise bno passport valid travel document said move response uk decision offer right eligible bno passport seek path citizenship uk said offer breached memorandum agreement promised uk would provide permanent right abode bno passportholders since uk violated commitment let know take measure recognise bno passport valid travel document said refusal recognise bno passport theory raise prospect ten thousand hong kong citizen trapped city refused reentry leave country try return although confusion practical impact policy since hong kong resident say leave reenter hong kong without showing bno passport id card normally sufficient pas immigration also urged british politician follow huawei decision forcing china frenchled nuclear project hinkley point c saying project would allow uk meet commitment reach zerocarbon emission press conference came alongside article south china morning post said british newspaper would publish threatening withdraw several billion investment following government decision ban huaweis product g mobile network liu wrote company announced investment plan bn next five year positive vote growth britain unfortunately subject uncertainty light british government recent decision also suggested uk decision meant uk may miss development bonus china world fastestgrowing economy liu ambassador uk decade also defended disqualification prodemocracy candidate autumn legislative election hong kong saying new security law nothing free speech targeted criminal repeatedly said china desire export model promising want threaten challenge replace anyone insisted china threatens one let know consequence china want friend uk uk partner want partner friend want treat china hostile power pay price thousand reason make relationship successful one reason make fail
2022-06-23,Tory MPs warn of backlash against easing of UK-China trade,Guardian ,Jessica Elgot,2022-02-17,"Tory MPs warn of backlash against easing of UK-China trade
This article is more than 2 years old
Boris Johnson is driving change of approach despite party voices campaigning on Uyghur genocide

Jessica Elgot
Thu 17 Feb 2022 15.23 GMT
Share
Conservative MPs have warned of a parliamentary backlash following steps taken by the government to ease tensions with China, designed to pave the way for better trading relations.

Over the past few weeks, Boris Johnson has quietly signalled a thaw in frosty relations since the decision in 2020 to exclude Chinese telecoms giant Huawei from the UK’s 5G network.

His communications chief, Guto Harri, is a former spinner for Huawei, though his previous chief of staff, Dan Rosenfield, had also been an advocate of mending relations.

The prime minister has ordered a restart of the UK-China Joint Economic and Trade Commission [Jetco] and this year Rishi Sunak is understood to be on the verge of agreeing the return of annual trade summit, the 11th UK-China Economic and Financial Dialogue (EFD), which has not been held since 2019.

“The Treasury cannot shake the orthodoxy that we must have better trading terms with China,” one senior source said. “But it is Downing Street who really wants this. Boris has always been uneasy about having to cancel Huawei.”

The EFD has previously been used to announce lucrative commercial contracts and closer trade cooperation but a Treasury source played down the significance of the return of the EFD, “if it goes ahead at all”, and said it would be a chance for dialogue rather that leading to any major changes.

The source said it was wrong to portray Sunak as the driving force. “It’s the chancellor’s view that our principles should guide our relationship with China. We need to be eyes wide open about their increasing international influence and must take a principled stand on issues that conflict with our own values.”

The move to defrost relations with Beijing is understood to be a source of tension between Johnson and his foreign secretary, Liz Truss. “Liz is a proper China hawk,” another senior government source said. Truss is scheduled to meet the delegation of MPs who were banned from China for lobbying for sanctions to oppose the Uyghur genocide in the coming days.

The UK’s trade deficit with China has more than tripled in the last year, importing £40.5bn more from China than it exported to the country.

Any significant change of approach threatens to reopen splits with backbenchers, especially those who have been blacklisted by Beijing and who are understood to feel they have received no tangible support from government, including on crucial issues like cybersecurity.

Sir Iain Duncan Smith, the former cabinet minister, said it “beggars belief that we are about to re-invent the failed project kowtow” and blamed the Treasury and Downing Street for an overeagerness to normalise relations. “Whether it is the CCP’s illegal seizure and militarisation of the South China seas or the trashing of the Sino/British agreement on Hong Kong, the Treasury seems ready to turn a blind eye to it all.”

There is also continued frustration about Johnson’s stonewalling over the appointment of Tim Loughton, one of the MPs banned from China, to the chair of the Conservative Human Rights commission.

The body had been a leading internal Tory pressure group, particularly on Hong Kong which led to its blacklisting by Beijing, but Johnson has declined to approve Loughton as chair for more than a year. Its previous chair, Fiona Bruce, resigned after being appointed a special envoy on religious freedom by Johnson.

Loughton has been a strong critic of the prime minister’s conduct over “partygate” as well as the cut to international aid. The rights activist Benedict Rogers, the commission’s deputy chair, is understood to have privately expressed deep frustration at the impasse. Rogers declined to comment.

Another source from inside the group said they were “deeply troubled about this government’s commitment to freedom and human rights, the rule of law and democracy”.

Other MPs who have been sanctioned include Tom Tugendhat, chair of the foreign affairs select committee, Nus Ghani, the former transport minister who has been a leading campaigner on Uyghur genocide, and Neil O’Brien, the Levelling Up minister.

The sanction came after their campaign to insert a clause in the trade bill, which would have permitted the high court to make a preliminary ruling on whether genocide was occurring in a potential trading partner, a clause design to put barriers on a trade deal with China.

Loughton, MP for East Worthing and Shoreham, said the government should be aware of a significant parliamentary backlash to any change of approach towards China.

“Parliament has made it very clear that a government guilty of genocide needs to be treated with extreme caution and cannot be welcomed as an equal partner,” he said. “It would be an insult to parliament if the government were to ignore our concerns not least when seven Parliamentarians remain sanctioned simply for speaking the truth and standing up to China’s bullying and abuse.”

Bob Seeley, who will lead a backbench debate on China next week, said: “We need to engage, but we have to engage as much on our own terms as possible and was understanding the risks of doing so.

“I think we have not yet got our heads around these new authoritarian states and both the obvious threats they pose but also the more subtle threats they pose. We are trying to have business as normal. The world has changed. You’re not a sabre-rattler or a war monger for stating what everyone can see.”",,,,,,,,,tory mp warn backlash easing ukchina trade article year old boris johnson driving change approach despite party voice campaigning uyghur genocide jessica elgot thu feb gmt share conservative mp warned parliamentary backlash following step taken government ease tension china designed pave way better trading relation past week boris johnson quietly signalled thaw frosty relation since decision exclude chinese telecom giant huawei uk g network communication chief guto harri former spinner huawei though previous chief staff dan rosenfield also advocate mending relation prime minister ordered restart ukchina joint economic trade commission jetco year rishi sunak understood verge agreeing return annual trade summit th ukchina economic financial dialogue efd held since treasury cannot shake orthodoxy must better trading term china one senior source said downing street really want boris always uneasy cancel huawei efd previously used announce lucrative commercial contract closer trade cooperation treasury source played significance return efd go ahead said would chance dialogue rather leading major change source said wrong portray sunak driving force chancellor view principle guide relationship china need eye wide open increasing international influence must take principled stand issue conflict value move defrost relation beijing understood source tension johnson foreign secretary liz truss liz proper china hawk another senior government source said truss scheduled meet delegation mp banned china lobbying sanction oppose uyghur genocide coming day uk trade deficit china tripled last year importing bn china exported country significant change approach threatens reopen split backbencher especially blacklisted beijing understood feel received tangible support government including crucial issue like cybersecurity sir iain duncan smith former cabinet minister said beggar belief reinvent failed project kowtow blamed treasury downing street overeagerness normalise relation whether ccps illegal seizure militarisation south china sea trashing sinobritish agreement hong kong treasury seems ready turn blind eye also continued frustration johnson stonewalling appointment tim loughton one mp banned china chair conservative human right commission body leading internal tory pressure group particularly hong kong led blacklisting beijing johnson declined approve loughton chair year previous chair fiona bruce resigned appointed special envoy religious freedom johnson loughton strong critic prime minister conduct partygate well cut international aid right activist benedict rogers commission deputy chair understood privately expressed deep frustration impasse rogers declined comment another source inside group said deeply troubled government commitment freedom human right rule law democracy mp sanctioned include tom tugendhat chair foreign affair select committee nu ghani former transport minister leading campaigner uyghur genocide neil obrien levelling minister sanction came campaign insert clause trade bill would permitted high court make preliminary ruling whether genocide occurring potential trading partner clause design put barrier trade deal china loughton mp east worthing shoreham said government aware significant parliamentary backlash change approach towards china parliament made clear government guilty genocide need treated extreme caution cannot welcomed equal partner said would insult parliament government ignore concern least seven parliamentarian remain sanctioned simply speaking truth standing china bullying abuse bob seeley lead backbench debate china next week said need engage engage much term possible understanding risk think yet got head around new authoritarian state obvious threat pose also subtle threat pose trying business normal world changed youre sabrerattler war monger stating everyone see
